{
  "$schema": "edx-agency/handoff/builder@1",
  "phase": 0,
  "date": "2026-04-07",
  "status": "completed",
  "blockedReason": null,
  "blockedDetail": null,
  "from": "builder",
  "filesChanged": [
    { "path": "src/errors.ts", "change": "created", "notes": "AppErrorCode enum with CONFIG_INVALID and SERVER_ERROR" },
    { "path": "src/config.ts", "change": "created", "notes": "Zod schema for PORT and LOG_LEVEL; imports dotenv/config at module load" },
    { "path": "src/server.ts", "change": "created", "notes": "createApp() factory; security headers and 64KB body limit applied to every request; handleRequest is async for enforceBodyLimit" },
    { "path": "src/index.ts", "change": "created", "notes": "Entry point: loadConfig -> pino -> createApp -> start" }
  ],
  "publicInterfaces": [
    { "name": "Config", "file": "src/config.ts", "signature": "export type Config = { PORT: number; LOG_LEVEL: 'trace' | 'debug' | 'info' | 'warn' | 'error' }" },
    { "name": "loadConfig", "file": "src/config.ts", "signature": "export function loadConfig(): Config" },
    { "name": "createApp", "file": "src/server.ts", "signature": "export function createApp(config: Config, log: Logger): App" },
    { "name": "App", "file": "src/server.ts", "signature": "export type App = { start(): Promise<void>; stop(): Promise<void> }" }
  ],
  "edgeCasesFound": [
    "PORT=0 passes Zod min(1) check at schema level -- confirmed min is 1, not 0",
    "server.close() passes an error to the callback when no connections were open on some Node versions -- handled with null check"
  ],
  "knownLimitations": [
    "No request body parsing -- GET-only routes, not needed for this phase",
    "No graceful SIGTERM handling -- can be added in a later phase"
  ],
  "deferredItems": [
    "SIGTERM / SIGINT graceful shutdown",
    "Request body parsing",
    "Route prefix support"
  ]
}
